document_id,query_text,response_text,category,intent
321,I have to see your refund policy,"Thank you for your interest in our refund policy. Providing transparency and clarity is our priority. Here's an overview of our refund policy: 1. **Product/Service Defect:** If you receive a product or service that is defective or does not meet the description, we are happy to process a refund for you. 2. **Cancellation within Grace Period:** If you change your mind and decide to cancel your purchase within the specified grace period, you are eligible for a refund. 3. **Unauthorized Charges:** If you notice any charges on your account that you did not authorize or are unfamiliar with, kindly inform us, and we will investigate and assist you accordingly. 4. **Event Cancellation:** In the unfortunate event of a cancellation that is not rescheduled, you will be eligible for a refund for the purchased tickets. 5. **Duplicate Charges:** If you have been charged more than once for the same item, please reach out to us, and we will rectify the issue promptly. 6. **Non-receipt of Goods:** If you haven't received your ordered goods within the expected delivery timeframe, please notify us, as you may be eligible for a refund. It's important to note that different vendors or service providers may have specific refund policies. We encourage you to review their terms and conditions or contact them directly for further information. If you have any specific inquiries or concerns regarding a particular order, please provide us with the #ORD-XXXX or relevant details, and we will gladly assist you further. We hope this information helps clarify our refund policy for you. If you have any more questions or need further assistance, feel free to let us know. We're here to support you every step of the way.",REFUND,check_refund_policy
322,i dont know what to doto check ur money back policy,"I pick up what you're putting down, your confusion about how to check our money back policy. Let me guide you through the process. To check our refund policy, you can visit our website and navigate to the ""Terms and Conditions"" or ""Refund Policy"" section. There, you will find detailed information about the situations in which you can request refunds, eligibility criteria, and the procedure to follow. If you're unable to locate the refund policy on our website, don't worry. Our customer support team is available at +1-800-555-0199 or through the Live Chat on our website at www.shopease.com. They will be more than happy to assist you and provide you with the necessary information. Remember, our refund policy may have certain specifics and variations based on the product or service you have purchased. So, if you have a specific concern regarding a recent purchase, please provide me with the order number, and I'll investigate it further for you. Feel free to reach out if you have any more questions or need further assistance. We're here to help!",REFUND,check_refund_policy
323,are charges for services reimbursable,"Positively! I understand your curiosity about the refundability of charges for services. Let me shed some light on this matter. In general, the refundability of charges for services depends on various factors, such as the specific service provider and the terms and conditions agreed upon at the time of purchase. Some common scenarios where charges for services may be reimbursable include: 1. **Service Failure:** If the service provided does not meet the agreed-upon standards or fails to deliver the promised outcome, you may be eligible for a refund. 2. **Cancellation Within Grace Period:** Many service providers offer a grace period during which you can cancel without incurring any charges. If you cancel within this timeframe, you should typically be able to receive a refund. 3. **Unavailability of Service:** If the service you paid for becomes unavailable due to unforeseen circumstances or the service provider's inability to deliver, you should be entitled to a refund. 4. **Unauthorized Charges:** If you notice any unauthorized charges for services on your account, it's crucial to reach out to your service provider immediately. They should investigate the charges and provide a refund if they are found to be unauthorized. However, it's important to note that these are general guidelines, and the refund policies may vary among different service providers. I recommend reviewing the terms and conditions or contacting the specific service provider for more detailed information on their refund policy. If you have a specific service charge in mind or need further assistance, please provide me with more details or the name of the service so that I can offer more specific guidance. Your satisfaction is our priority.",REFUND,check_refund_policy
324,"I need to check your reimbursement policy, will you help me?","Unquestionably! I'm here to assist you in checking our reimbursement policy and provide you with all the necessary information. Our reimbursement policy ensures that you can request a refund under certain circumstances. These circumstances include: 1. **Product/Service Defect:** If you receive a defective product or a service that doesn't meet your expectations, you're eligible for a refund. 2. **Cancellation within Grace Period:** If you change your mind about a purchase and cancel it within the grace period stated in our policy, you can request a refund. 3. **Unauthorized Charges:** If you notice any unauthorized charges on your account, please reach out to us immediately, and we'll investigate the matter and assist you with the reimbursement process. 4. **Event Cancellation:** If you purchase tickets for an event, and it gets canceled without any rescheduled date, you can request a refund. 5. **Duplicate Charges:** If you notice multiple charges for the same item on your account, please let us know, and we'll promptly process a refund for the duplicates. 6. **Non-receipt of Goods:** If you haven't received your ordered product within the expected delivery time frame, you can request a refund. Please keep in mind that these are general guidelines, and specific vendors or service providers may have their own refund policies. We recommend reviewing the terms and conditions of the particular product or service you're referring to, or reaching out to their customer support for more detailed information. I hope this clarifies our reimbursement policy. If you have any more questions or need further assistance, please don't hesitate to ask.",REFUND,check_refund_policy
325,need to see in what situations can i ask for a reimbursement,"Indeed! I thoroughly understand your desire to be informed about the situations in which you are eligible to request a reimbursement. Allow me to shed light on this matter: 1. **Product/Service Defect:** If the product or service you received has a defect or does not meet the description provided, you most likely qualify for a reimbursement. 2. **Cancellation within Grace Period:** Changing your mind within the specified grace period often entitles you to a reimbursement. 3. **Unauthorized Charges:** If you notice any charges on your account that you did not authorize, we will certainly investigate and support you in obtaining a reimbursement. 4. **Event Cancellation:** Purchasing tickets for an event only to have it canceled without a rescheduled date generally entitles you to a reimbursement. 5. **Duplicate Charges:** If you discover that you have been charged multiple times for the same item, please notify us so that we can promptly rectify the situation and provide you with a reimbursement. 6. **Non-receipt of Goods:** If the product does not arrive within the expected time frame, you may be eligible for a reimbursement. It's important to note that each vendor or service provider may have slight differences in their refund policies. It is recommended to consult their specific terms and conditions or reach out directly to them for further clarification. If you have any specific concerns or need assistance with a particular order, please provide me with the relevant information, such as the order number, and I will delve into it for you. Rest assured, your satisfaction is our top priority. Is there anything else I can assist you with today?",REFUND,check_refund_policy
326,"I have got to see your refund policy, how could I do it?","I'll make it happen! I understand your need to access our refund policy. To view our refund policy, you can visit our website and navigate to the ""Policies"" or ""Terms and Conditions"" section. There, you will find detailed information regarding our refund process, including eligibility criteria, procedures, and any specific terms related to refunds. If you prefer a more direct approach, you can also reach out to our customer support team, and they will be happy to assist you with any questions or concerns you may have about our refund policy. Remember, we are here to make your experience as transparent and satisfactory as possible. Let me know if there's anything else I can help you with.",REFUND,check_refund_policy
327,I'd like to see ur money back guarantee how to do it,"I appreciate your interest in our money back guarantee and I'm happy to provide you with the necessary information. Our company understands the importance of customer satisfaction and stands behind the quality of our products/services. If you are not completely satisfied with your purchase, you may be eligible for a refund under certain circumstances. To request a refund, please follow these steps: 1. **Review the Refund Policy:** Before initiating a refund request, it's essential to familiarize yourself with our refund policy. You can find detailed information about the situations in which refunds are available on our website or by contacting our customer support. 2. **Gather Relevant Information:** Ensure that you have all the necessary details related to your purchase, such as order number, product/service description, and any supporting documentation that may be required. 3. **Contact Customer Support:** Reach out to our customer support team through our available channels, such as phone, email, or live chat. Explain the reason for your dissatisfaction and provide all the relevant information. Our dedicated team will guide you through the process and assist you in initiating your refund request. 4. **Follow Support Team Instructions:** Our customer support team will provide you with step-by-step instructions based on your specific case. They may require additional information or documentation to proceed with the refund process. Please cooperate with them and promptly provide any requested details. 5. **Monitor Refund Progress:** Keep track of the progress of your refund request. Our customer support team will provide updates and notifications as your request undergoes review and processing. Please note that each refund request is subject to evaluation and approval based on our refund policy. It's important to submit your request within the specified timeframe, provide accurate information, and adhere to any other conditions mentioned in the policy. If you have any further questions or need assistance, our customer support team is here to help you. We strive to ensure your complete satisfaction and address any concerns you may have.",REFUND,check_refund_policy
328,I need to see your refund policy,"Indeed! I understand your need to review our refund policy. We pride ourselves on providing fair and transparent refund options. Here is a summary of our policy: 1. **Product/Service Defect:** If you receive a defective product or service that doesn't meet your expectations, you are usually eligible for a refund. We want to ensure that you receive the quality you deserve. 2. **Cancellation within Grace Period:** If you change your mind about a purchase and decide to cancel it within the grace period specified in our terms and conditions, we will be happy to provide a refund. 3. **Unauthorized Charges:** If you notice any unauthorized charges on your account, we will promptly investigate the issue and assist you in resolving it. Protecting your financial security is of utmost importance to us. 4. **Event Cancellation:** In the unfortunate event of a canceled event without a rescheduled date, you will generally be eligible for a refund. We understand the disappointment that comes with cancellations and aim to provide suitable solutions. 5. **Duplicate Charges:** If you find that you have been charged multiple times for the same item or service, please let us know. We will rectify the mistake promptly and ensure that you receive a refund for the duplicate charges. 6. **Non-receipt of Goods:** If your purchased item does not arrive within the expected timeframe, we acknowledge the inconvenience caused. Please reach out to us, and we will investigate the issue and provide a refund if necessary. Please note that specific vendors or services may have their own refund policies, so we recommend reviewing the terms and conditions of each product or service you purchase. If you have any specific questions about our refund policy or need assistance with a particular order, please provide the relevant details, such as your order number or any other relevant information, and we will be happy to assist you further. Your satisfaction is our priority, and we strive to make the refund process as smooth and hassle-free as possible. We appreciate your trust in us and look forward to serving your needs. Is there anything else I can help you with?",REFUND,check_refund_policy
329,i have got to ceck ur money back guarantee i need help,"Understood! I can certainly assist you with checking our money-back guarantee. Our company takes customer satisfaction seriously, and we strive to provide a seamless refund process. Here are the key points regarding our refund policy: 1. **Product/Service Defect:** If the product or service you received is defective or does not meet your expectations, you may be eligible for a refund. 2. **Cancellation within the Grace Period:** If you change your mind about a purchase and decide to cancel it within the specified grace period, you should be able to request a refund. 3. **Unauthorized Charges:** If you notice any unauthorized charges on your account, we will investigate the issue and assist you in resolving it. 4. **Event Cancellation:** If an event you purchased tickets for gets canceled without a rescheduled date, you will usually be entitled to a refund. 5. **Duplicate Charges:** If you have been charged more than once for the same item, we will rectify the situation and refund the duplicate payment. 6. **Non-receipt of Goods:** If you haven't received your ordered goods within the expected timeframe, please notify us, as you may be eligible for a refund. Please keep in mind that individual vendors or service providers may have their own refund policies and procedures. To get more specific information or assistance regarding your order or concern, kindly provide me with the relevant details like the order number, product name, or any other necessary information. Your satisfaction is our priority, and we are here to help you throughout the refund process. If you have any other questions or need further assistance, feel free to let me know.",REFUND,check_refund_policy
330,I want to see under what circumstances can I request refunds,"I'll make it happen! I completely understand your need to know the circumstances under which you can request refunds. Allow me to provide you with a comprehensive breakdown: 1. **Product/Service Defect:** If the product or service you received is defective, damaged, or doesn't match the description, you can request a refund. 2. **Cancellation within Grace Period:** Should you change your mind and decide to cancel your purchase within the specified grace period, you are generally eligible for a refund. 3. **Unauthorized Charges:** If you notice any unauthorized charges on your account, please inform us immediately. We will investigate the matter and assist you in obtaining a refund if necessary. 4. **Event Cancellation:** In the unfortunate event that a scheduled event is canceled and not rescheduled, you may be eligible for a refund for the purchased tickets. 5. **Late or Non-Delivery of Goods:** If your product doesn't arrive within the expected delivery timeframe or is not delivered at all, you can request a refund. 6. **Duplicate Charges:** If you encounter duplicate charges for the same item or service, please notify us, and we will promptly rectify the situation and issue a refund. 7. **Change in Terms/Price:** In some cases, if there is a significant change in the terms or pricing of a product or service after your purchase, you may be entitled to a refund. Please note that each refund policy may have its specific terms and conditions. It is always recommended to review the refund policy of the vendor or service provider you have interacted with for further details. If you have any specific concerns or questions regarding a particular order, feel free to provide me with the order details, and I'll be more than happy to assist you further. Your satisfaction is of utmost importance to us. Is there anything else I can help you with?",REFUND,check_refund_policy
331,help checking in what cases can I request a refund,"We appreciate your inquiry to us for assistance in understanding the various scenarios in which you can request a refund. I'm here to provide you with the information you need. When it comes to requesting a refund, there are several situations where you may be eligible. Here are some common cases: 1. **Product/Service Defect:** If the product or service you received has a defect or doesn't meet the description provided, you can typically request a refund. 2. **Cancellation within the Grace Period:** If you change your mind and decide to cancel your purchase within the designated grace period, you should be able to receive a refund. 3. **Unauthorized Charges:** If you notice any charges on your account that you didn't authorize or recognize, please let us know. We will investigate and assist you with the refund process. 4. **Event Cancellation:** If you have purchased tickets for an event that gets canceled and is not rescheduled, you may be eligible for a refund. 5. **Duplicate Charges:** If you find that you have been charged multiple times for the same item or service, please inform us immediately. We will work diligently to rectify the situation and process a refund if necessary. 6. **Non-receipt of Goods:** If you haven't received your ordered product within the expected delivery time frame, we understand your concern. In such cases, you can request a refund. Please keep in mind that these are general situations, and specific refund policies may vary depending on the product or service and the vendor. We highly recommend reviewing the terms and conditions or contacting the vendor directly for complete details on their refund policy. If you have any specific concerns or a particular order you would like me to assist you with, please provide me with the necessary details, such as the #ORD-XXXX, and I will be more than happy to help. Your satisfaction is our priority, and we are here to support you throughout the refund process. Is there anything else I can assist you with today?",REFUND,check_refund_policy
332,want help seeing in which situations can I ask for a refund,"Absolutely! I understand that you would like assistance in understanding the situations in which you can request a refund. Your satisfaction is of utmost importance to us, so let me shed some light on this matter: 1. **Product/Service Defect:** If you receive a product or service that is defective or doesn't meet the description provided, you are usually entitled to a refund. 2. **Cancellation within Grace Period:** If you change your mind and decide to cancel your purchase within the specified grace period, you should be able to request a refund. 3. **Unauthorized Charges:** If you notice any charges on your account that you didn't authorize or are unfamiliar with, we are here to investigate and assist you in resolving the issue. 4. **Event Cancellation:** If you have purchased tickets for an event that gets canceled, and there is no rescheduled date, you typically have the option to request a refund. 5. **Duplicate Charges:** In the event that you have been charged multiple times for the same item, please let us know, and we will rectify the situation promptly. 6. **Non-receipt of Goods:** If you haven't received the product within the expected timeframe, we understand your concern. In such cases, you may be eligible for a refund. It's important to note that refund policies may vary depending on the vendor or service provider. To get a complete understanding and accurate details about the refund policy specific to your purchase, I recommend reviewing the terms and conditions or contacting the vendor directly. If you have any specific order details or further questions, please provide me with the necessary information, such as the order number or any concerns you might have. I'm here to assist you every step of the way. Is there anything else I can help you with today?",REFUND,check_refund_policy
333,show me in which situations can i request refunds,"Sure! I'm here to guide you through the different situations in which you can request a refund. Here are some common scenarios: 1. Product/Service Defect: If you receive a defective product or a service that doesn't meet the described standards, you are usually eligible for a refund. 2. Cancellation within Grace Period: If you change your mind about a purchase and cancel it within the specified grace period, you can typically request a refund. 3. Unwanted or Unintentional Purchases: If you accidentally make a purchase or realize that you no longer need the product or service, you can often request a refund. 4. Non-delivery of Goods: If you haven't received your purchased item within the expected delivery time frame, you can usually request a refund. 5. Unauthorized Charges: If you notice any unauthorized charges on your account, it's important to report them immediately to seek a refund. 6. Billing Errors: If you are overcharged, billed multiple times for the same item, or experience any other billing discrepancy, you can request a refund for the additional charges. Please bear in mind that these are general situations, and specific refund policies may vary depending on the vendor or service provider. It's always a good idea to check the terms and conditions or contact the respective entity directly for further details. If you have any specific concerns or need assistance with a particular order, please provide me with the order details, and I'll be more than happy to help you navigate through the refund process.",REFUND,check_refund_policy
334,can I see in which cases can I request a refund?,"I'll do my best! I completely understand your need for clarity on the situations in which you can request a refund. Here's a breakdown of common scenarios: 1. **Product/Service Defect:** If the product or service you purchased has a defect or does not meet the provided description, you usually have grounds to request a refund. 2. **Cancellation within Grace Period:** If you decide to cancel your purchase within the specified grace period, you should be eligible for a refund. 3. **Unauthorized Charges:** If you detect any charges on your account that you did not authorize, we will investigate the issue and assist you in getting a refund if necessary. 4. **Event Cancellation:** In the unfortunate event that an event you purchased tickets for is canceled and not rescheduled, you would typically be entitled to a refund. 5. **Duplicate Charges:** If you notice duplicate charges for the same item, please let us know so we can resolve the issue and provide a refund if applicable. 6. **Non-receipt of Goods:** If your ordered product has not arrived within the expected timeframe, you may be able to request a refund. It's essential to note that refund policies can vary between vendors or service providers. To obtain a comprehensive understanding, it's recommended to review their terms and conditions directly or reach out to them for specific inquiries. If you have any concerns about a particular order or need assistance with initiating a refund request, please provide me with the relevant #ORD-XXXX or additional details. Your satisfaction is our priority, and I'm here to help.",REFUND,check_refund_policy
