document_id,query_text,response_text,category,intent
1,I cannot afford purchase #ORD-XXXX,"I understand the financial constraints you are facing and the need to cancel purchase #ORD-XXXX. Our goal is to assist you in the best way possible. To proceed with the cancellation, please follow these steps: 1. Sign in to Your Account: Access our our company portal by signing in with your credentials. 2. Navigate to Your Orders: Once you are signed in, locate the 'your order' or 'your order' section. 3. Find the Relevant Purchase: Look for the purchase associated with the order number #ORD-XXXX and click on it for more details. 4. Initiate Cancellation: You will see an option labeled 'your order.' Please select this option to begin the cancellation process. 5. Complete the Cancellation: Follow any further instructions or prompts to complete the cancellation successfully. If you encounter any issues or have any questions during the process, please don't hesitate to contact our dedicated customer support team during . You can reach us at +1-800-555-0199 or use the Live Chat feature on our website at www.shopease.com. We are committed to your satisfaction and will do our best to assist you.",ORDER,cancel_order
2,"I have bought some item, I have to cancel order #ORD-XXXX","I recognize that you've recently made a purchase and now wish to cancel the order with the order number #ORD-XXXX. I apologize for any inconvenience this may have caused. To proceed with the cancellation, please follow these steps: 1. Sign in to Your Account: Access our platform by logging in to your our company portal. 2. Find Your Order History: Once logged in, navigate to the 'your order' or 'your order' section. 3. Locate Your Purchase: Look for the specific purchase associated with the order number #ORD-XXXX and click on it. 4. Initiate Cancellation: Within the purchase details, you should find an option labeled 'your order'. Please select this option. 5. Confirm Cancellation: The system may request additional information or confirmation before finalizing the cancellation. Kindly provide any required details or follow the prompts to proceed. If you encounter any difficulties or need further assistance during the cancellation process, please don't hesitate to reach out to our dedicated support team. They are available during at +1-800-555-0199 or through the Live Chat feature on our website at www.shopease.com. Your satisfaction is our priority, and we're here to help you every step of the way.",ORDER,cancel_order
3,"I do not want this item, cancel order #ORD-XXXX","I've observed that you no longer want the item associated with the order number #ORD-XXXX. I apologize for any inconvenience this may have caused. Let's proceed with canceling your order to ensure your satisfaction. Here's what you need to do: 1. Sign into Your Account: Log in to your our company portal. 2. Access Your Orders: Go to the 'your order' or 'your order' section. 3. Locate the Order: Look for the order with the number #ORD-XXXX and click on it. 4. Initiate Cancelation: You will find a 'your order' option associated with your purchase. Please select it. 5. Confirm the Cancellation: Follow any additional prompts or provide feedback as required to complete the cancellation process. If you have any further questions or encounter any hiccups along the way, our dedicated support team is available to assist you. You can reach out to us during at +1-800-555-0199 or use the Live Chat feature on our www.shopease.com. Your satisfaction is our top priority, and we are here to ensure a seamless experience for you.",ORDER,cancel_order
4,I need assistance with canceling purchase #ORD-XXXX,"I'm attuned to the idea that you require assistance with canceling your purchase associated with the order number #ORD-XXXX. Rest assured, I am here to guide you through the cancellation process. Here's what you need to do: 1. Log into Your Account: Access our platform by signing in to your our company portal. 2. Navigate to the Order Management Section: Once logged in, locate the section for managing your orders, such as 'your order' or 'your order'. 3. Locate the Specific Purchase: Within the order management section, you should be able to find the purchase linked to the order number #ORD-XXXX. Click on it to access the details. 4. Initiate the Cancellation: Look for the option labeled 'your order' associated with your purchase. Please select this to begin the cancellation process. 5. Follow any Additional Steps: Depending on our cancellation policy, there might be additional steps involved, such as providing a reason for cancellation or confirming your decision. Please complete these steps as instructed. 6. Confirmation and Refund: Once the cancellation is successfully processed, you should receive a confirmation message, and any refunds or reimbursements will be initiated according to our refund policy. If you encounter any obstacles or have further questions during the cancellation process, our dedicated support team is available to assist you. Feel free to contact us during at +1-800-555-0199 or through the Live Chat feature on our www.shopease.com. Your satisfaction is our top priority, and we want to ensure that your cancellation experience goes smoothly.",ORDER,cancel_order
5,were can i cancel purchase #ORD-XXXX,"I realized, you're looking for the information on where to cancel purchase #ORD-XXXX. Allow me to guide you through the process: 1. Sign into Your Account: Access our platform by signing in to your our company portal. 2. Navigate to Your Orders: Once logged in, head over to the 'your order' or 'your order' section. 3. Find Your Order: Look for the purchase with the order number #ORD-XXXX. 4. Initiate Cancellation: You should see an option labeled 'your order' associated with your purchase. Click on it. 5. Complete Any Further Steps: If prompted, answer any questions or provide the necessary feedback to facilitate the cancellation process. If you encounter any difficulties or have further questions, our dedicated team is available during at +1-800-555-0199 or via Live Chat on our www.shopease.com. Rest assured, we're here to assist you in every step towards your satisfaction.",ORDER,cancel_order
6,want assistance to cancel order #ORD-XXXX,"I've understood, you're seeking assistance with canceling your order linked to the number #ORD-XXXX. I apologize for any inconvenience caused, and rest assured, I'm here to help you navigate through this process. Here's what you can do: 1. Follow our Cancellation Process: Log into your our company portal using your credentials. 2. Locate Your Order: Once logged in, head to the 'your order' or 'your order' section to find the relevant purchase. 3. Initiate the Cancellation: Click on the order number associated with purchase #ORD-XXXX and look for the 'your order' option. Go ahead and select it. 4. Confirm and Provide Feedback: The system may ask you to confirm the cancellation and provide any feedback you might have. If you encounter any difficulties or have further questions, don't hesitate to reach out to our dedicated support team. They are available during at +1-800-555-0199 or through the Live Chat feature on our website at www.shopease.com. We value your satisfaction and are committed to assisting you every step of the way.",ORDER,cancel_order
7,I don't know what to do to cancel purchase #ORD-XXXX,"I hear you loud and clear your confusion about canceling purchase #ORD-XXXX. Don't worry, I'm here to assist you with the process. To cancel your purchase, follow these simple steps: 1. Sign into your account: Log in to your our company portal using your credentials. 2. Locate the order details: Navigate to the 'your order' or 'your order' section. 3. Find the specific purchase: Look for the purchase with the order number #ORD-XXXX and click on it to access the details. 4. Initiate the cancellation: Within the order details, you should see an option labeled 'your order' or a similar term. Click on it to proceed with the cancellation request. 5. Confirmation and feedback: The system may ask you to confirm the cancellation or provide feedback. Please follow the prompts and complete the necessary steps. If you encounter any difficulties or have further questions during the process, our dedicated team is available during at +1-800-555-0199. You can also reach us through the Live Chat feature on our www.shopease.com. Your satisfaction is our priority, and we're here to help make this cancellation process as smooth as possible.",ORDER,cancel_order
8,i cannot pay for my last item cancel order #ORD-XXXX,"I've noticed that you're facing difficulties in paying for your last item and need assistance with canceling order #ORD-XXXX. It can be frustrating when financial constraints prevent us from completing a purchase. Allow me to help you with this. To cancel your order, please follow these steps: 1. Log in to your our company portal using your username and password. 2. Navigate to your order history or account settings page. 3. Locate the specific order with the order number #ORD-XXXX. 4. Click on the order to access the details. 5. Look for the option to cancel the order and select it. 6. Confirm the cancellation and follow any additional prompts if necessary. If you encounter any issues or have further questions, feel free to reach out to our customer support team. They are available during at +1-800-555-0199 or through live chat on our www.shopease.com. We are committed to assisting you throughout this process and ensuring your satisfaction.",ORDER,cancel_order
9,I want help to cancel purchase #ORD-XXXX,"I'm with you that you are seeking assistance with canceling your purchase with the order number #ORD-XXXX. Our team is here to help guide you through the process and ensure a seamless experience. Here's what you need to do: 1. Log into Your Account: Start by signing into your our company portal. 2. Access Your Order History: Once logged in, navigate to the 'your order' or 'your order' section. 3. Locate the Purchase: Look for the specific purchase associated with the order number #ORD-XXXX. Click on it to view the details. 4. Initiate the Cancellation: You should see an option labeled 'your order' associated with your purchase. Please select this to proceed with the cancellation. 5. Confirm the Cancellation: Our system may ask you to confirm the cancellation or gather some feedback. Kindly complete any necessary steps. If you encounter any difficulties or have further questions throughout the process, our dedicated team is available to assist you. You can reach us during at +1-800-555-0199 or engage in a live chat on our website at www.shopease.com. Your satisfaction is our priority, and we appreciate your trust in our services.",ORDER,cancel_order
10,I need help with cancelling purhase #ORD-XXXX,"I'm sensitive to the fact that you need assistance with cancelling purchase #ORD-XXXX. I apologize for any inconvenience this may have caused. To cancel your purchase, please follow these steps: 1. Log into your account: Access our our company portal and sign in using your credentials. 2. Navigate to your orders: Once signed in, go to the 'your order' or 'your order' section. 3. Locate your purchase: Look for the purchase associated with the order number #ORD-XXXX and click on it for more details. 4. Initiate cancellation: Within the purchase details, you will find an option to 'your order'. Please select this option. 5. Confirm cancellation: The system may ask for your confirmation or feedback to complete the cancellation process. Kindly provide the necessary information. If you encounter any difficulties or have further questions, do not hesitate to contact our dedicated support team. You can reach us during at +1-800-555-0199 or through the Live Chat feature on our website at www.shopease.com. We value your satisfaction and are here to assist you every step of the way.",ORDER,cancel_order
11,whag do i need to do to cancel order #ORD-XXXX,"I get it that you're uncertain about the steps required to cancel order #ORD-XXXX. Allow me to provide you with the guidance you need: 1. Sign in to Your Account: Start by logging in to your our company portal using your credentials. 2. Locate Your Orders: Once you're logged in, navigate to the 'your order' or 'your order' section. 3. Find the Relevant Order: Look for the order with the number #ORD-XXXX and click on it for more details. 4. Initiate the Cancellation: Within the order details, you should find an option labeled 'your order'. Please select this to begin the cancellation process. 5. Complete Any Additional Steps: Our system might prompt you with a few questions or ask for feedback. Kindly provide the necessary information to proceed. Should you encounter any difficulties or have further queries along the way, feel free to reach out to our dedicated support team. They are available during at +1-800-555-0199 or through the Live Chat feature on our website at www.shopease.com. We appreciate your trust in our service, and we're here to ensure your satisfaction.",ORDER,cancel_order
12,cancel purchase #ORD-XXXX,"I've realized that you would like to cancel your purchase with the order number #ORD-XXXX. Our team is here to assist you with this process. To cancel your purchase, please follow these steps: 1. Sign in to your our company portal using your registered credentials. 2. Navigate to the 'your order' or 'your order' section. 3. Look for the purchase with the order number #ORD-XXXX. 4. Click on the purchase to access the details. 5. Locate the 'your order' option associated with the purchase. 6. Select the option to initiate the cancelation process. 7. Complete any additional steps or provide feedback as required by the system. If you encounter any difficulties or have further questions, our dedicated support team is available during . You can reach us at +1-800-555-0199 or through the Live Chat feature on our www.shopease.com. We appreciate your understanding, and we're here to provide assistance every step of the way.",ORDER,cancel_order
13,help me to cancel purchase #ORD-XXXX,"I'm aware that you need assistance with canceling your purchase with the order number #ORD-XXXX. I apologize for any inconvenience this may have caused you. To cancel your purchase, please follow these steps: 1. Log in to your our company portal using your credentials. 2. Proceed to the 'your order' or 'your order' section. 3. Look for the purchase associated with the order number #ORD-XXXX and click on it. 4. You will see an option labeled 'your order'. Please select this option to initiate the cancellation process. 5. The system may ask for additional information or confirmation. Kindly follow the prompts and provide the necessary details. 6. Once the cancellation is processed, you will receive a confirmation email or notification. If you encounter any difficulties or have any further questions, our dedicated customer support team is available to assist you. You can reach us at +1-800-555-0199 or through the Live Chat feature on our www.shopease.com. Please don't hesitate to contact us. We are here to help ensure your satisfaction.",ORDER,cancel_order
14,"I bought some item, cancel purchase #ORD-XXXX","I've picked up that you recently made a purchase and now would like to cancel the order with the purchase number #ORD-XXXX. I apologize for any inconvenience this may cause. To assist you with the cancellation process, please follow these steps: 1. Sign into Your Account: Access our platform by signing in to your our company portal. 2. Navigate to Your Orders: Once logged in, locate the 'your order' or 'your order' section. 3. Find Your Order: Within this section, locate the purchase with the order number #ORD-XXXX and click on it for more details. 4. Initiate Cancellation: Look for the option labeled 'your order' associated with your purchase. Please select it to proceed with cancelling the order. 5. Complete Any Further Steps: The system may ask you a few questions to confirm the cancellation or provide feedback. Please follow the instructions provided. If you encounter any difficulties or have further questions throughout the process, our dedicated customer support team is available to assist you. You can reach out to us during at +1-800-555-0199 or through the Live Chat feature on our www.shopease.com. Your satisfaction is our priority, and we appreciate your understanding.",ORDER,cancel_order
15,I do not know what to do to cancel purchase #ORD-XXXX,"Thank you for getting in touch to us for assistance with canceling purchase #ORD-XXXX. I'm here to guide you through the process. To cancel your purchase, please follow these steps: 1. Sign into your account: Access our platform by logging into your our company portal. 2. Navigate to your order history: Once logged in, find the 'your order' or 'your order' section. 3. Locate your purchase: Look for the purchase associated with the order number #ORD-XXXX and click on it for more details. 4. Initiate the cancellation: Within the order details, you should see an option labeled 'your order'. Please select that to start the cancellation process. 5. Confirm and complete the cancellation: Our system may ask you a few questions or require some additional information to finalize the cancellation. Please provide the necessary details as prompted. If you encounter any difficulties or have more questions along the way, our dedicated support team is available to help. You can reach us during at +1-800-555-0199 or through the Live Chat on our website at www.shopease.com. We value your satisfaction and will do our best to assist you promptly.",ORDER,cancel_order
16,I need assistancde cancelling order #ORD-XXXX,"I've noticed that you require assistance with canceling your order with the order number #ORD-XXXX. Our team is ready to help you with this process. To proceed with the cancellation, please follow these steps: 1. Log in to your our company portal using your credentials. 2. Navigate to the 'your order' or 'your order' section, where you can find a list of your previous purchases. 3. Locate the specific purchase associated with the order number #ORD-XXXX and click on it to access the details. 4. Look for the option labeled 'your order' and select it. 5. The system may prompt you to confirm the cancellation or provide feedback. Please follow the instructions accordingly. Should you encounter any difficulties or have further questions, our dedicated support team is available to assist you. You can reach us during at +1-800-555-0199 or by using our live chat feature on our www.shopease.com. We are here to ensure your satisfaction and provide the help you need.",ORDER,cancel_order
17,how could I cancel purchase #ORD-XXXX?,"I've picked up that you are looking for guidance on canceling your purchase with the order number #ORD-XXXX. Rest assured, I'll provide you with the necessary steps to proceed with the cancellation: 1. Sign into Your Account: Begin by logging into your our company portal using your credentials. 2. Visit the Order Page: Once logged in, navigate to the 'your order' or 'your order' section of your account. 3. Locate the Purchase: Look for the purchase associated with the order number #ORD-XXXX and click on it to access the details. 4. Initiate the Cancellation: On the purchase page, you should find an option labeled 'your order'. Click on it to start the cancellation process. 5. Confirm the Cancellation: The system may request a final confirmation from you. Please follow the instructions provided to complete the cancellation. If you encounter any difficulties or have further questions, our attentive support team is available during . Feel free to reach out by calling +1-800-555-0199 or utilizing the live chat feature on our www.shopease.com. Your satisfaction is our priority, and we're here to assist you every step of the way.",ORDER,cancel_order
18,"I doln't want order #ORD-XXXX, can you cancel it?","I'm following you that you no longer want to proceed with your order with the order number #ORD-XXXX. I apologize for the inconvenience caused. To cancel your order, please follow these steps: 1. Log in to your our company portal. 2. Go to the ""your order"" or ""your order"" section. 3. Locate your order with the order number #ORD-XXXX. 4. Click on the order to access the details. 5. Look for the ""your order"" option and select it. 6. Follow any additional instructions or prompts to complete the cancellation process. If you encounter any difficulties or have any questions, our dedicated team is ready to assist you. You can reach out to us during at +1-800-555-0199 or use the Live Chat feature on our www.shopease.com. We appreciate your understanding and thank you for choosing our services.",ORDER,cancel_order
19,want assistance canceling purchase #ORD-XXXX,"I've become conscious that you're seeking assistance in canceling your purchase with the order number #ORD-XXXX. We apologize for any inconvenience caused by this situation. To cancel your purchase, please follow these steps: 1. Log into your our company portal. 2. Navigate to your ""your order"" or ""your order"" section. 3. Locate the purchase associated with the order number #ORD-XXXX and click on it for more details. 4. Look for the ""your order"" option linked to your purchase and click on it. 5. Follow any additional prompts or confirmations to complete the cancellation process. If you encounter any difficulties or have further questions, please feel free to reach out to our dedicated customer support team during at +1-800-555-0199. We're also available to assist you through the Live Chat feature on our website at www.shopease.com. We appreciate your understanding, and we're here to help ensure a smooth resolution for you.",ORDER,cancel_order
20,I need assistance canceling purchase #ORD-XXXX,"I've picked up that you need assistance with canceling your purchase with the order number #ORD-XXXX. Your satisfaction is our utmost priority, and I'm here to help you through the process. To cancel your purchase, please follow these steps: 1. Sign in to Your Account: Start by logging in to your our company portal using your credentials. 2. Access Your Orders: Navigate to the 'your order' or 'your order' section, where you can view your recent purchases. 3. Locate Your Purchase: Look for the specific purchase with the order number #ORD-XXXX and click on it for more details. 4. Initiate Cancellation: You should find the option labeled 'your order' associated with your purchase. Please select this to proceed with the cancellation. 5. Confirm the Cancellation: The system may require you to provide additional information or confirm your decision. Kindly follow the prompts to complete the cancellation process. If you encounter any difficulties or have further questions during the cancellation process, our dedicated team is available to provide assistance. You can reach us during at +1-800-555-0199 or via the Live Chat feature on our www.shopease.com. We appreciate your understanding, and we'll do our best to ensure a seamless experience for you.",ORDER,cancel_order
21,where culd i cancel order #ORD-XXXX,"I gather that you're looking for the location to cancel your order associated with the purchase number #ORD-XXXX. To cancel your order, please follow these steps: 1. Log into your our company portal using your credentials. 2. Navigate to the 'your order' or 'your order' section. 3. Look for the order with the purchase number #ORD-XXXX. Click on it to view the order details. 4. In the order details, you should find an option labeled 'your order' or a similar variation. Select that option. 5. Follow any additional prompts or provide any necessary information to complete the cancellation process. If you encounter any difficulties or have any further questions, please don't hesitate to reach out to our dedicated customer support team. You can contact us during at +1-800-555-0199 or through the Live Chat on our website at www.shopease.com. We appreciate your understanding and apologize for any inconvenience caused. Our goal is to ensure your satisfaction, and we're here to assist you every step of the way.",ORDER,cancel_order
22,what do I need to do to cancel purchase #ORD-XXXX?,"I'm clearly cognizant that you're seeking guidance on canceling your purchase with order number #ORD-XXXX. To cancel your purchase, please follow these steps: 1. Login to Your Account: Access our platform by logging into your account on the our company portal. 2. Navigate to Your Orders: Once logged in, locate the 'your order' or 'your order' section. 3. Find Your Order: Look for the purchase linked to the order number #ORD-XXXX and click on it. 4. Initiate Cancellation: Within the order details, you'll find the option to 'your order'. Please select this option. 5. Complete the Cancellation Process: You may be asked to provide feedback or answer a few questions during the cancellation process. Please provide the necessary information to complete the cancellation. If you encounter any difficulties or require further assistance, our dedicated team is here to support you. You can reach us during at +1-800-555-0199 or through the Live Chat feature on our www.shopease.com. Your satisfaction is our top priority, and we are committed to ensuring a seamless cancellation experience for you.",ORDER,cancel_order
