document_id,query_text,response_text,category,intent
1018,help to reset my user account pin,"Rest assured, I'm here to assist you in resetting the PIN for your user account. Let's work together to get you back on track: 1. Begin by logging into your user account on our platform. 2. Once logged in, navigate to the ""Account Settings"" or ""Profile Settings"" section. The exact name and location may vary depending on our platform's layout. 3. In the account settings, look for the ""Change PIN"" or ""Reset PIN"" option. 4. Click on the option and follow the on-screen instructions to complete the PIN reset process. 5. Make sure to choose a strong and unique PIN that you can remember, but others cannot easily guess. 6. If you encounter any difficulties or have further questions during the process, please don't hesitate to reach out to our support team for assistance. Remember, you're not alone in this journey. I'm here to provide guidance and support every step of the way.",ACCOUNT,recover_password
1019,can you help me to retrieve my user profile key?,"Of course, I'm here to assist you in retrieving your user profile key. It's essential to have access to your account, and I'll guide you through the process step by step. 1. First, please go to the login page of our platform. 2. Look for the option that says ""Forgot User Profile Key"" and click on it. 3. You will be redirected to a page where you can enter the email address associated with your user profile. 4. Once you've entered the email, click on the ""Submit"" button. 5. An email containing instructions to retrieve your user profile key will be sent to the email address you provided. 6. Please check your inbox for the email. 7. If you don't see the email in your inbox, please check your spam or junk folder. 8. Follow the instructions in the email to retrieve your user profile key. If you encounter any difficulties during the process or have any further questions, please don't hesitate to reach out to me. I'm here to ensure you regain access to your account successfully.",ACCOUNT,recover_password
1020,"I want to restore my profile PIN code, I need help","Great! I'm here to assist you in restoring your profile PIN code, ensuring a secure and smooth process. Let's get started on the path to regaining access to your account: 1. To initiate the process, please visit our platform's """" section. 2. Once there, look for the option to """", and select it. 3. You may be prompted to verify your identity through a few security measures, such as answering security questions or providing other account details. 4. After successfully completing the verification process, you will be able to reset your PIN code to a new one of your choice. Should you encounter any hurdles or if you need further guidance throughout the process, don't hesitate to reach out. We'll be right here, accompanying you on your journey to restore your profile PIN code!",ACCOUNT,recover_password
1021,find information about my lost PIN,"Absolutely! I understand how concerning it can be to lose your PIN and not know where to find the necessary information. Rest assured, I'm here to guide you: 1. Begin by visiting our online platform at ""www.shopease.com"". 2. On the homepage, look for the section labeled ""your account settings"" or """". 3. Within the account or profile settings, search for the """" or """" tab. 4. Under this tab, you should find an option to """" or """". 5. Click on this option, and you'll be directed to a page where you can retrieve the information about your lost PIN. Remember, if you encounter any difficulties or if you have any further questions, don't hesitate to reach out to our customer support team. We're here to assist you every step of the way!",ACCOUNT,recover_password
1022,information about a PIN recovery,"I can definitely provide you with the necessary information regarding the recovery of your PIN. Losing or forgetting your PIN can be frustrating, but don't worry, we're here to assist you every step of the way. To recover your PIN, please follow these simple steps: 1. Visit our platform's login page and click on the ""Forgot PIN"" option. 2. You will be prompted to enter your email address associated with your account. 3. An email will be sent to you with instructions on how to reset your PIN. 4. Make sure to check your inbox for the email. If you don't see it, please also check your spam or junk folder. 5. Once you receive the email, follow the instructions provided to reset your PIN securely. If you encounter any issues during the recovery process or if you have any questions, please feel free to reach out to us. We are here to help you regain access to your account and ensure a seamless experience.",ACCOUNT,recover_password
1023,find information about my access key retrieval,"I recognize your need to find information about retrieving your access key. Your access key is crucial for accessing your account securely. Allow me to guide you through the process: 1. Visit our platform's website and proceed to the login page. 2. Look for the option labeled ""Forgot Access Key"" or a similar prompt. 3. Click on it, and you will be redirected to the access key retrieval page. 4. Follow the instructions provided on that page to initiate the retrieval process. 5. You may be required to provide some verification details or answer security questions to verify your identity. 6. Once you have completed the necessary steps, you will receive further instructions on how to retrieve your access key. If you encounter any difficulties or have further questions along the way, feel free to reach out to our customer support team. They are available 24/7 to assist you and ensure a smooth process of access key retrieval. Remember, we understand the importance of your access key, and we are here to support you every step of the way.",ACCOUNT,recover_password
1024,need hepl recovering my user profile PIN,"Unquestionably! I understand that you're facing difficulties in recovering your user profile PIN. Rest assured, I'm here to guide you through the process and help you regain access to your account. 1. The first step is to navigate to our platform's login page. You can find it by visiting our website at www.shopease.com. 2. On the login page, look for the ""Forgot PIN"" option. Click on it to proceed. 3. You will be prompted to provide some verification information to confirm your identity and initiate the PIN recovery process. Follow the instructions provided, such as verifying your email address or answering security questions. 4. Once you have completed the necessary verification steps, you will receive an email with further instructions on how to reset your user profile PIN. Be sure to check both your inbox and spam folder for this email. 5. Follow the instructions in the email carefully to set up a new PIN for your user profile. If you encounter any issues or have any questions during this process, don't hesitate to reach out to our customer support team. They are available at +1-800-555-0199 or through the live chat on our website at www.shopease.com. Remember, we're here to support you every step of the way. You'll have access to your user profile in no time!",ACCOUNT,recover_password
1025,help recovering my profile access key,"I'll get right on it! I'm here to assist you in recovering your profile access key. Rest assured, we'll work together to resolve this issue promptly. To start the process, please follow these steps: 1. Visit our platform's """" and click on the option that says """". 2. You may be required to verify your identity by providing certain account-related information or answering security questions. 3. Once your identity has been confirmed, a reset link will be sent to the email address associated with your profile. 4. Open the email and click on the provided link to proceed with accessing your account key. 5. You'll be directed to a secure page where you can create a new access key. Make sure to choose a strong and unique key for enhanced security. 6. After successfully setting up your new access key, close the browser and revisit the login page to log in again using your updated credentials. Remember, if you encounter any issues or have additional questions during the process, don't hesitate to reach out to us. We're dedicated to supporting you throughout this journey to regain access to your profile.",ACCOUNT,recover_password
1026,what do I have to do to recover my user PIN?,"Oh no, it sounds like you're experiencing trouble recovering your user PIN. Don't worry, I'm here to assist you every step of the way! To recover your user PIN, please follow these instructions: 1. Go to the login page of our platform and locate the ""Forgot PIN"" option. 2. Click on the ""Forgot PIN"" option, and you will be guided to a verification page. 3. Provide the required information, such as your username or email address, to verify your identity. 4. Once your identity is confirmed, you will receive an email with instructions on how to reset your user PIN. 5. Follow the instructions in the email carefully to create a new, secure PIN for your account. If you encounter any difficulties during this process or if you don't receive the email within a reasonable timeframe, please don't hesitate to reach out to our support team. They are available at +1-800-555-0199 or through the Live Chat on our website at www.shopease.com. Rest assured, we'll make sure you regain access to your account and set a new user PIN in no time.",ACCOUNT,recover_password
1027,help to retrieve my profile PIN code,"I'll make it happen! I completely understand the importance of retrieving your profile PIN code. Let's work together to resolve this: 1. Please navigate to your account settings on our platform. 2. Look for the option to manage your profile settings or security settings. 3. Within that section, you should find an option to reset or retrieve your PIN code. 4. Follow the provided instructions carefully, which may involve answering security questions or verifying your identity. 5. Once you successfully complete the steps, you should be able to retrieve your profile PIN code. If you encounter any difficulties or have further questions, please feel free to reach out. We're here to assist you at every step and ensure your profile PIN code is successfully retrieved.",ACCOUNT,recover_password
1028,I have got to retrieve my PIN code,"Oh, retrieving your PIN code is essential to ensure access to your account. Let's work together to resolve this: 1. To retrieve your PIN code, please visit our website and navigate to the account recovery section. 2. You will be prompted to provide some necessary information to verify your identity, such as your email address or phone number associated with your account. 3. Once you've entered the required details, a verification code will be sent to your registered email address or phone number. This will help us verify your identity and ensure the security of your account. 4. Enter the verification code on the recovery page. 5. After verification, you will be guided through the process of generating a new PIN code for your account. 6. Make sure to choose a strong and unique PIN code that you can remember easily. If you encounter any difficulties or have further questions during this process, don't hesitate to reach out to our support team. We're here to assist you every step of the way and make sure you regain access to your account successfully.",ACCOUNT,recover_password
1029,I want help retrieving the password of my account,"Unquestionably! I completely understand the importance of regaining access to your account by retrieving your password. It can be frustrating and concerning when you're locked out. But don't worry, I'm here to guide you through the process and find a solution. To retrieve your account password, follow these steps: 1. Visit the login page of our platform by going to [Insert Login Page URL]. 2. Look for the ""Forgot Password"" option and click on it. 3. You may be asked to provide your email address or account username. Make sure to enter the correct information associated with your account. 4. Once you've entered the required details, you should receive an email with instructions on how to reset your password. Please check your inbox, spam folder, or any other email filters if you don't see it in your main inbox. 5. Follow the instructions provided in the email to reset your password. Create a strong and unique password that meets our security requirements. 6. After setting up your new password, try logging in with the updated credentials to ensure successful access to your account. Remember, if you encounter any difficulties or have additional questions during the password retrieval process, feel free to reach out to our customer support team. They are available at +1-800-555-0199 or through the Live Chat on our website at www.shopease.com. We're here to assist you every step of the way and ensure you regain control of your account securely and efficiently.",ACCOUNT,recover_password
1030,help to restore my user password,"Of course! I'm here to assist you in restoring your user password. We can navigate through the process step by step to ensure a smooth resolution: 1. Let's begin by visiting the """" of our platform. 2. Look for the option that says """" and click on it. 3. You'll be prompted to enter the email associated with your user account. Please provide that information. 4. Shortly after, you should receive an email with detailed instructions on how to reset your password. Remember to also check your spam or junk folders, just in case. 5. Follow the instructions provided in the email to create a new, secure password for your user account. If you encounter any difficulties during this process or if the email doesn't arrive, don't hesitate to reach out to me. I'm here to guide you every step of the way!",ACCOUNT,recover_password
1031,"I lost my access key, help me retrieving it","I'll get right on it! I'm here to assist you in retrieving your access key. Losing access to your key can be frustrating, but don't worry, we'll work together to solve this. Here's what you can do: 1. Reach out to our customer support team via email or phone. They will help you with the necessary steps to retrieve your access key. You can find their contact information on our website. 2. Provide them with the necessary information to verify your identity and ownership of the account. This may include your name, email address, and any other relevant details. 3. Once your identity is verified, they will guide you through the process of retrieving your access key. They may provide you with a new key or help you reset your existing key. 4. Make sure to keep your access key safe and secure once you retrieve it. Consider using password managers or other secure methods to store your key. Remember, our customer support team is here to assist you every step of the way. Feel free to reach out to them if you have any further questions or concerns. We appreciate your patience and understanding during this process.",ACCOUNT,recover_password
1032,I have got to restore the password of my account,"Absolutely! I'm here to guide you through the process of restoring the password for your account. We understand how important it is for you to regain access. Here's what you can do: 1. Head over to the login page of our platform. 2. Look for the ""Forgot Password"" option and click on it. 3. Provide the email address associated with your account. 4. In a short while, you should receive an email with instructions on how to reset your password. Be sure to check your spam or junk folders if you don't see it in your inbox. 5. Follow the instructions in the email to create a new, secure password for your account. If you encounter any difficulties or if the email doesn't arrive, don't hesitate to reach out to us. We're here to assist you every step of the way and ensure your account is secure and accessible.",ACCOUNT,recover_password
1033,where can I retrieve my user pwd ?,"I'll take care of it! I completely understand your need to retrieve your user password. Allow me to guide you on the right path: 1. Start by visiting our platform's """". 2. Once you're there, look for the option that says """" and select it. 3. You will be prompted to enter the email address associated with your user account. 4. Expect an email with detailed instructions on how to reset your password. Remember to check your spam or junk folders, just in case it decided to take a detour. 5. Follow the steps provided in the email carefully to set up a new, secure password for your account. If you encounter any difficulties during this process or if the email does not arrive within the expected timeframe, please don't hesitate to reach out to me. Rest assured, I'm here to support you every step of the way!",ACCOUNT,recover_password
1034,what do I have to do to recover the PIN of my account?,"Ah, I see that you're looking to recover the PIN of your account. Don't worry, I'm here to assist you every step of the way. Let's get started on the journey to regain access to your account: 1. Begin by visiting our platform's """". 2. Look for the option to recover your PIN and select it. 3. You'll be prompted to provide some information to verify your identity, such as your email address or phone number associated with your account. This will help us ensure that it's really you. 4. Once your identity is verified, you'll be guided through the process of resetting your PIN securely. Follow the instructions carefully to set up a new PIN that meets our security requirements. 5. After completing the steps, your account will be updated with the new PIN, and you'll be able to access it again. Remember, if you encounter any difficulties or have any questions along the way, feel free to reach out to our customer support team. We're always here to help you navigate through any challenges and ensure a smooth account recovery process.",ACCOUNT,recover_password
1035,"someone stole my profile PIN, how can I reset it?","Oh no! I'm truly sorry to hear that someone stole your profile PIN. I understand how distressing this must be for you. Let's take immediate action to reset it and restore the security of your account: 1. Go to our platform's """" page. 2. If prompted, provide any necessary verification details such as your email address or phone number associated with your account. Security is our top priority! 3. Follow the instructions carefully to reset your PIN. We'll make sure to guide you step by step through this process. 4. Take a moment to set up a strong and unique PIN that you haven't used before. This ensures the highest level of security for your account. 5. Once you're done, double-check that your new PIN is working by logging into your account successfully. Remember, if you face any difficulties or need further assistance, don't hesitate to reach out to our dedicated support team. We're here to help 24/7 and prioritize your account's security.",ACCOUNT,recover_password
1036,I need information about the pwd rertieval,"I'll make it happen! I'm here to provide you with all the necessary information about retrieving your password. Restoring your access is our top priority, so let me break it down for you: 1. Begin by visiting our """". 2. Look for the """" option on the login page and click on it. 3. You will be prompted to provide the email address associated with your account. 4. Once you've submitted your email, our system will send you an email with detailed instructions on how to reset your password. 5. Make sure to check your inbox for the email. If you don't see it in your main inbox, please check your spam or junk folders. 6. Follow the instructions in the email to create a new, secure password for your account. If you encounter any difficulties during the process or if you have any further questions, please don't hesitate to reach out. We're here to guide you every step of the way and ensure a smooth password retrieval experience.",ACCOUNT,recover_password
1037,where to recover the PIN of my user?,"I've observed that you need assistance in recovering the PIN for your user account. Let me guide you through it: 1. Begin by visiting the """" page on our platform. 2. Once you're on the recovery page, you'll be prompted to enter your registered email or username. Provide the necessary details as requested. 3. After submitting the information, a verification process will be initiated to confirm your identity. Follow the instructions and complete the verification process. 4. Once your identity is verified successfully, you'll be guided through the steps to reset your PIN code. In case you face any difficulties during the process or if you have any further questions, please don't hesitate to reach out. Our support team is always here to provide you with the assistance you need.",ACCOUNT,recover_password
1038,need assistance retrievign my user password,"Indeed! I understand the importance of retrieving your user password. Let's work together to regain access to your account: 1. To begin, please visit our """". 2. Look for the """" option and click on it. 3. You will be asked to enter the email address associated with your account. Please provide the email address that you used during the registration process. 4. Once you have entered your email address, an email will be sent to you with detailed instructions on how to reset your password. Please keep in mind that it may take a few moments for the email to arrive, so I kindly ask for your patience. 5. Make sure to check your inbox, as well as your spam or junk folders, just in case the email gets filtered there. 6. Follow the instructions in the email to set a new password for your user account. If you encounter any difficulties during this process or if you have any further questions, please don't hesitate to reach out to me. I'm here to provide you with the assistance you need to regain access to your account.""",ACCOUNT,recover_password
1039,I do not know how to reset my user profile PIN code,"Definitely! I understand that resetting your user profile PIN code can be a bit confusing. Not to worry, I am here to assist you. To reset your user profile PIN code, follow these steps: 1. Log in to your account on our platform using your current PIN code. 2. Once logged in, navigate to the ""User Profile"" section or ""Account Settings"" page. 3. Look for the option that says ""Reset PIN Code"" or ""Change PIN Code"". 4. Click on that option and you will be prompted to enter a new PIN code. 5. Choose a new PIN code that is secure and easy for you to remember. 6. Confirm the new PIN code and save the changes. If you encounter any difficulties or have any further questions, please don't hesitate to reach out. I'm here to help you throughout the process.",ACCOUNT,recover_password
1040,I need assistance retrieving the PIN of my account,"Sure thing! I completely understand your need for assistance in retrieving the PIN of your account. Rest assured, I'm here to guide you through the process: 1. First, log in to your account using your username and password. 2. Once you're logged in, navigate to the Account Settings or Profile Settings section. 3. Look for the Security or PIN settings option. It may be labeled as ""Change PIN"" or ""Reset PIN."" 4. Click on the option and follow the on-screen instructions to reset your PIN. You may be required to verify your identity through additional security measures. 5. After successfully resetting your PIN, make sure to save it in a secure place for future reference. If you encounter any difficulties or have any further questions, feel free to reach out. I'll be more than happy to assist you at every step of the way. Remember, we're here for you!""",ACCOUNT,recover_password
1041,"I lost my user PIN, what do I have to do to reset it?","No need to worry! I'm here to guide you through the process of resetting your user PIN. Let's embark on this journey together: 1. Start by visiting the login page of our platform. 2. Look for the option that says ""Forgot PIN"" and click on it. 3. You may be asked to provide some information to verify your identity. This could be your email address or other account details. 4. Once your identity is confirmed, you'll receive an email with instructions on how to reset your PIN. Take a moment to check your inbox and any spam or junk folders, just in case the email takes a detour. 5. Follow the instructions in the email to create a new and secure PIN for your user account. Remember, if you encounter any challenges along the way or if the email doesn't arrive as expected, don't hesitate to reach out to me. I'll be more than happy to assist you throughout the entire process!",ACCOUNT,recover_password
1042,i need assistance to reset the pin code of my account,"Sure! I'm here to guide you through the process of resetting the PIN code for your account. We understand the importance of keeping your account secure and accessible. Here's what you need to do: 1. Log in to your account on our platform using your current login credentials. 2. Navigate to the account settings or profile section, where you can manage your account information. 3. Look for the option to reset your PIN code. It might be labeled as ""Change PIN"" or ""Reset PIN"" depending on the platform. 4. Follow the on-screen instructions to complete the PIN reset process. You may be asked to verify your identity through additional security measures. 5. Once you've successfully reset your PIN code, make sure to securely store it in a safe place, away from any prying eyes. If you encounter any difficulties or have any further questions along the way, don't hesitate to reach out. We'll be glad to assist you in every step of the process. We're committed to ensuring the security and convenience of your account experience.",ACCOUNT,recover_password
