document_id,query_text,response_text,category,intent
623,can i order from your country,"I'll get right on it! We welcome orders from the your country with open arms. We value our international customers and strive to provide a seamless ordering experience across borders. Rest assured, we have the necessary systems and processes in place to ensure smooth delivery of your desired products from the your country to your location. Feel free to explore our delivery options that cater perfectly to your needs. Should you have any further queries or if there's anything else I can assist you with, please don't hesitate to reach out. Your complete satisfaction is our priority!",DELIVERY,delivery_options
624,do you ship to your city?,"I'm on it! We have shipping services available for your city, ensuring that our customers in that area can receive their orders promptly. We understand the importance of reliable and efficient delivery, and we're committed to making it happen for you. So go ahead and place your order with confidence, knowing that we can deliver it to your city seamlessly. If you have any other questions or need further assistance, feel free to ask. We're here to help!",DELIVERY,delivery_options
625,do ya deliver to your country,"Definitely! I'm thrilled to let you know that we do offer delivery services to your country. We understand the importance of catering to our valued customers in different parts of the world, including your country. Whether it's Helsinki, Tampere, or any other city in your country, we've got you covered. You can explore our delivery options specific to your country during the checkout process on our website. If you have any specific concerns or questions regarding delivery to your country, feel free to ask. We're here to ensure a seamless shipping experience for you.",DELIVERY,delivery_options
626,I have to check what shipment methods you offer,"Of course! I'm here to assist you in exploring our range of shipment methods. We understand the importance of providing flexible options to meet your needs. Here are the shipment methods we offer: 1. Standard Shipping: This is our most popular option, and it usually takes the specified date range business days to arrive. It's perfect for non-urgent shipments and comes at a budget-friendly price. 2. Express Shipping: If you need your items a bit faster, Express Shipping is a great choice. It typically takes the specified date range business days to deliver your package. It's a reliable and speedy option. 3. Same-Day Delivery: For those times when time is of the essence, we offer Same-Day Delivery. Place your order by 5:00 PM and receive it at your doorstep on the same day. It's perfect for urgent orders. 4. Store Pickup: If you prefer a more hands-on approach, you can choose Store Pickup. Simply place your order online, and it will be ready for you to pick up at your nearest your nearest store. Remember, the exact delivery times may vary based on factors like your location and item availability. Should you have any further questions or need assistance with your shipment, please don't hesitate to ask. We're here to ensure your satisfaction!",DELIVERY,delivery_options
627,I have got to see what shipment options I can choose,"Oh, the excitement of exploring different options! It's wonderful to hear that you're eager to discover the shipment options available to you. Allow me to shed light on the array of choices that await you: 1. Standard Shipping: Delighting you within the specified date range business days, this option is perfect for non-urgent items. 2. Expedited Shipping: Need your items sooner? Opt for this faster alternative, with delivery in the specified date range business days. 3. Overnight Shipping: For those urgent needs, rest assured your package will arrive the very next business day. 4. In-Store Pickup: If convenience and personal touch are your preferences, this option allows you to collect your items from our your nearest store. As you consider the different shipment options, I'm here to answer any further questions you may have. Your satisfaction is of utmost importance to us, and I'm dedicated to making your experience a seamless and delightful one.",DELIVERY,delivery_options
628,is it plssible to order from your country?,"Unquestionably! We offer international shipping, including deliveries to the your country. When placing an order, you can select the your country as your shipping destination, and we will ensure a seamless delivery experience from our end. Please note that there may be additional charges or customs fees associated with international shipments, which will be calculated and displayed during the checkout process. If you have any specific concerns or questions about ordering from the your country, feel free to let me know. I'm here to assist you every step of the way!",DELIVERY,delivery_options
629,do uship to your city,"Positively! We do offer shipping to your city, ensuring that you can conveniently receive your order at your desired location. your city is one of our delivery destinations, and you can choose from our various shipping options to suit your needs. If you have any specific concerns or questions about shipping to your city, feel free to let me know and I'll be more than happy to assist you further.",DELIVERY,delivery_options
630,need help to check what methods for delivery i have,"I'll get right on it! I'm here to assist you in exploring our various methods for delivery. Allow me to break down the options for you: 1. Standard Shipping: This option is ideal if you're not in a rush, as it typically arrives within the specified date range business days. 2. Expedited Shipping: If you need your items a bit faster, this method ensures delivery in the specified date range business days. 3. Overnight Shipping: For urgent needs, this option guarantees next business day delivery. 4. In-Store Pickup: If you prefer the convenience of picking up your items yourself, you can select this method and collect them at our your nearest store. Remember, these delivery times can vary based on factors such as location and product availability. If you have any specific questions or if there's anything else I can assist you with, please feel free to let me know. Customer satisfaction is our top priority!",DELIVERY,delivery_options
631,is it possible to place an order from your country?,"Greetings from our global service! We happily serve customers from various corners of the world, including your country. You can easily place an order on our website and have it delivered to your desired location in your country. We believe in making your shopping experience seamless, no matter where you are. If you need any further assistance or have any specific concerns, feel free to ask. We're here to assist you every step of the way!",DELIVERY,delivery_options
632,I need help to check what shipment methods are there,"For sure! Allow me to assist you in exploring the various shipment methods available to you. Here are some of our popular delivery options: 1. Standard Shipping: This option is perfect for non-urgent items and usually arrives within the specified date range business days. 2. Expedited Shipping: If you're looking for a faster delivery, our expedited shipping option will get your items to you in the specified date range business days. 3. Overnight Shipping: For those urgent needs, our overnight shipping ensures next business day delivery. 4. In-Store Pickup: If you prefer picking up your items personally, we offer the convenience of in-store pickup at our your nearest store. Remember, the actual delivery time may vary based on your location and other factors. If you have any specific concerns or there's anything else I can assist you with, please feel free to ask. I'm here to ensure your satisfaction throughout your shipping experience.",DELIVERY,delivery_options
633,i have to check the shipment methods i need assistance,"I'll get right on it! I'm here to provide the assistance you need in exploring our shipment methods. Let's dive into the details together. Our delivery options include: 1. Standard Shipping: This method typically takes the specified date range business days and is perfect for non-urgent items. 2. Expedited Shipping: If you need your items a bit faster, this option ensures delivery within the specified date range business days. 3. Overnight Shipping: For urgent needs, we offer next business day delivery to ensure your items arrive promptly. 4. In-Store Pickup: If you prefer a more personal touch, you can choose to pick up your items from our your nearest store. Each option has its own benefits, so it's important to select the one that aligns best with your needs. Should you have any questions or need further assistance in making your decision, feel free to ask. I'm here to guide you every step of the way!",DELIVERY,delivery_options
634,is it possible to place an order from your country,"I'll get right on it! We are absolutely thrilled to serve our valued customers in your country. You can easily place an order from your country through our website or mobile app. Just browse our wide range of products, add them to your cart, and proceed to the checkout. During the checkout process, you'll be asked to provide your shipping address in your country, and we'll take care of the rest. We strive to ensure a seamless and delightful shopping experience for all our customers, regardless of their location. If you have any specific questions or need further assistance, please don't hesitate to reach out. We're here to help you every step of the way!",DELIVERY,delivery_options
635,can you help me checking what shipping options I have?,"For sure! I'm here to assist you in exploring the various shipping options available to you. Let's dive into our comprehensive range of delivery choices: 1. Standard Shipping: This is our most economical option, typically arriving within the specified date range business days. 2. Expedited Shipping: If you need your items a little faster, this option ensures delivery within the specified date range business days. 3. Overnight Shipping: For those urgent needs, we offer next business day delivery. 4. International Shipping: If you're shipping outside of the country, we provide reliable international shipping services to numerous destinations around the world. Each option is tailored to meet your specific requirements, whether it's speed, affordability, or international delivery. If you have any particular concerns or questions about these shipping options, feel free to let me know. I'm here to help you make the best choice for a satisfying delivery experience!",DELIVERY,delivery_options
636,how to see what methods for delivery I can choose?,"I'll get right on it! Allow me to assist you in discovering the wide range of delivery methods available for you to choose from: 1. Visit our website: Browse through our online store and add the desired items to your cart. During the checkout process, you'll be presented with a selection of delivery options to choose from. 2. Contact our customer service: If you prefer a more personalized approach, our dedicated customer service team will be more than happy to guide you through the available delivery methods and assist you in making the right choice. You can reach them at +1-800-555-0199 or through our Live Chat on our website at www.shopease.com. 3. Explore our mobile app: If you're on the go, our mobile app allows you to conveniently view and choose from the various delivery methods. You'll find a detailed description and estimated delivery time for each option. 4. Visit our physical store: If you're nearby, feel free to visit one of our locations. Our friendly staff will help you explore the delivery options available and provide any necessary guidance. By following these steps, you'll be able to see and select the delivery method that suits your needs best. If you need any further assistance or have more questions, don't hesitate to let me know. I'm here to make your experience seamless and enjoyable!""",DELIVERY,delivery_options
637,is it possible to place na order from your country,"Oh, the excitement of international possibilities! Thankfully, we do offer the option to place an order from your country. Our global shipping services enable customers like you to enjoy our products and receive them right at your doorstep in your country. Simply choose your desired items, proceed to checkout, and select your country as your shipping address. We'll take care of the rest and ensure your order is delivered promptly and safely. If you have any specific concerns or if there's anything else I can assist you with, please don't hesitate to let me know. It's our pleasure to make your cross-border shopping experience seamless and delightful!",DELIVERY,delivery_options
638,"I have to see what delivery options you offer, help me","Sure! Let me guide you through the delightful realm of our delivery options. Here are the choices to elevate your shopping experience: 1. Standard Shipping: The reliable classic, which typically arrives within the specified date range business days. 2. Expedited Shipping: For those who prefer a swift delivery, expect your package in the specified date range business days. 3. Overnight Shipping: Ideal for urgent needs, ensuring your item arrives the next business day. 4. In-Store Pickup: If you're near one of our your nearest store, why not collect your order directly? Remember, these timeframes may vary slightly based on factors like location and product availability. If you have any specific requirements or further inquiries, please don't hesitate to let me know. I'm here to personalize your experience and ensure a smooth journey from purchase to delivery.",DELIVERY,delivery_options
639,check the available methods for delivery,"I'll do my best! Let's explore the enchanting world of our available delivery methods. Here are the options at your fingertips: 1. Standard Shipping: The most popular choice, guaranteeing delivery within the specified date range business days. 2. Expedited Shipping: Need your items sooner? Opt for this option, and they'll arrive in the specified date range business days. 3. Overnight Shipping: For those time-sensitive situations, rest easy knowing your package will be delivered the next business day. 4. In-Store Pickup: If convenience is your calling, choose this option, and you can collect your items directly from our your nearest store. Take a moment to consider your preferences. Which delivery method has caught your attention in the past? Remember, I'm here to provide guidance, clarity, and support for any questions or concerns you may have. Together, let's make your delivery experience unforgettable!",DELIVERY,delivery_options
640,deliverids to your country,"Sure! We offer delivery services to your country, ensuring that customers like you can receive their orders conveniently. Our delivery options include Standard Shipping, which typically arrives within a specified number of business days, Expedited Shipping for faster delivery, Overnight Shipping for urgent needs, and In-Store Pickup if you prefer to collect your items personally. Please note that the exact timeframes may vary based on factors such as location and current circumstances. If you have any specific concerns or if there's anything else I can assist you with, please feel free to let me know. Your satisfaction is our priority!",DELIVERY,delivery_options
641,"I would like to see what shipment methods I have, help me","Certainly! Allow me to guide you through our shipment methods, ensuring you make an informed decision: 1. Standard Shipping: This option offers reliable delivery within the specified date range business days, perfect for non-urgent items. 2. Expedited Shipping: If you're in a hurry, Expedited Shipping is the way to go. It ensures your items are delivered within the specified date range business days. 3. Overnight Shipping: Need your items urgently? Overnight Shipping guarantees next business day delivery. 4. In-Store Pickup: For a quick and convenient option, consider In-Store Pickup. Simply select this option during checkout and collect your items at our nearest your nearest store. By assessing your specific needs and the urgency of your items, you can choose the shipment method that best suits you. If you have any further questions or concerns, feel free to ask. I'm here to assist you every step of the way!",DELIVERY,delivery_options
642,can i place an order frim your country,"I'll take care of it! When it comes to placing an order from your country, we have got you covered. Our online ordering system is available for customers worldwide, including your country. Simply visit our website, browse through our products, and add the items you wish to purchase to your cart. During the checkout process, you will be able to enter your shipping address in your country, and our system will calculate the shipping cost and estimated delivery time for you. If you have any specific questions or need assistance with the ordering process, our customer service team is always here to help. Happy shopping from your country!",DELIVERY,delivery_options
643,i want assistance seeing what shipment methods are there,"I'm on it! I am here to provide you with the information you need about our shipment methods. Allow me to explain our available options: 1. Standard Shipping: This method typically takes the specified date range business days to reach its destination. It is ideal for non-urgent shipments. 2. Expedited Shipping: If you're looking for a faster delivery, we offer expedited shipping. With this option, your items will arrive in the specified date range business days. 3. Overnight Shipping: For urgent deliveries, we provide overnight shipping. This ensures that your items will be delivered by the next business day. 4. In-Store Pickup: If you prefer to collect your items in person, you can opt for in-store pickup. Simply select this option during the checkout process and choose your nearest store location. Please keep in mind that the exact delivery times may vary depending on factors such as the shipping address and item availability. If you have any specific questions or if there's anything else I can assist you with, feel free to let me know. It's my pleasure to help you!""",DELIVERY,delivery_options
644,shipnents to your country,"Ah, shipping to your country! You're in luck, we offer several shipment options for deliveries to your country. Here are our available shipping methods: 1. Standard Shipping: This option typically takes the specified date range business days to reach your country. It's ideal for non-urgent shipments. 2. Expedited Shipping: If you're in a hurry, we have expedited shipping available. It can get your items to your country within the specified date range business days. 3. Express Shipping: For time-sensitive deliveries, express shipping ensures your package arrives in your country quickly, typically within the specified date range business days. Please note that the exact delivery times may vary based on the specific location in your country and any other factors that may affect the shipment. If you have any further inquiries or need assistance with placing an order or tracking a shipment, please feel free to ask. Your satisfaction is our top priority!",DELIVERY,delivery_options
645,need to see what shipment options are there how to do it,"I'll take care of it! I can certainly assist you in exploring the shipment options available to you. Here are some steps to check the shipment options: 1. Visit our website and navigate to the product page of the item you are interested in. 2. Once you are on the product page, you will find information about the available shipment options. 3. Look for a section labeled ""Delivery Options"" or ""Shipping Information."" Click on it to view the different shipment options. 4. Take a moment to review the details of each option, including the estimated delivery timeframe and any additional costs associated with each method. 5. When you have identified the option that suits your needs, simply select it during the checkout process. If you have any specific questions or need further assistance while checking the shipment options, please feel free to ask. I'm here to help ensure you have a seamless and satisfying purchasing experience.",DELIVERY,delivery_options
646,can i order frrom your country,"Definitely! We are delighted to serve customers from the your country. You can easily place an order and enjoy our wide range of products, convenient delivery options, and exceptional service. Whether you're looking for standard shipping, expedited shipping, or even overnight shipping, we've got you covered. Feel free to explore our website or contact our customer service team for more information or assistance with your order. Happy shopping!",DELIVERY,delivery_options
647,is it plssible to order from your country?,"Positively! We offer international shipping to your country, allowing you to conveniently place an order and have it delivered right to your doorstep. Our dedicated team ensures a smooth shipping process to make your online shopping experience seamless. Feel free to explore our diverse range of products and place your order with confidence. If you have any specific questions or require further assistance, please don't hesitate to reach out. We're here to make your shopping experience extraordinary, no matter where you are!",DELIVERY,delivery_options
648,deliveries to your city,"Thank you for your question about deliveries to your city! We are pleased to inform you that we offer shipping options to your city, Canada. As one of our valued customers, you can choose from our standard shipping, expedited shipping, or even overnight shipping options to have your items delivered to your city. Our standard shipping usually takes the specified date range business days to reach your city. If you prefer a faster option, our expedited shipping can deliver your items in the specified date range business days. And for those urgent needs, we also offer overnight shipping, ensuring next business day delivery. Rest assured that we take great care in ensuring your packages reach you in a timely and secure manner. If you have any specific questions or if there's anything else I can assist you with, please feel free to ask. Our goal is to make your shopping experience as smooth and convenient as possible, even when it comes to deliveries to your city!",DELIVERY,delivery_options
649,help me see the methods for shipment,"For sure! I'm here to assist you in exploring the available shipping options. Let's dive into the world of convenient delivery methods: 1. Standard Shipping: This option typically arrives within the specified date range business days. It's perfect for non-urgent items when you have a bit of time to spare. 2. Expedited Shipping: If you're in a hurry, our expedited shipping option will get your items to you in the specified date range business days. You won't have to wait too long to enjoy your purchase! 3. Overnight Shipping: Need your items ASAP? Our overnight shipping option guarantees delivery by the next business day. You'll have your products in no time! 4. In-Store Pickup: For the ultimate convenience, you can always opt for in-store pickup. If you're near one of our your nearest store, you can grab your items personally without any shipping delays. These options may vary slightly based on your location and other factors. If you have any specific concerns or questions, please don't hesitate to let me know. Helping you find the perfect shipment method is my top priority!",DELIVERY,delivery_options
650,I am calling to see what shipment methods are there,"Thank you for calling in to inquire about our shipment methods. I'm more than happy to provide you with the necessary information. Here are the options available to you: 1. Standard Shipping: Typically arrives within the specified date range business days. This option is recommended for non-urgent items. 2. Expedited Shipping: A faster choice that delivers your items in the specified date range business days. 3. Overnight Shipping: Perfect for those urgent needs, ensuring next business day delivery. 4. In-Store Pickup: If you prefer to grab your items personally, this option allows you to collect them from our your nearest store. These options may vary depending on your location and other factors. If you have any specific questions or require further assistance, please don't hesitate to let me know. I'm here to ensure your satisfaction!""",DELIVERY,delivery_options
651,I need assistance checking how soon can I expect my delivery,"I pick up what you're putting down, your excitement to receive your delivery and the desire to have an estimated timeframe. To provide you with the most accurate information, may I kindly ask for the or #ORD-XXXX associated with your delivery? With that information, I will be able to provide you with an expected delivery date. Your patience is greatly appreciated as we work on resolving this for you.",DELIVERY,delivery_period
652,help to check how soon can I expect my shipment,"We understand your eagerness to receive your shipment as soon as possible. To determine the estimated delivery time, we kindly ask you to provide us with the or #ORD-XXXX associated with your shipment. With this information, we will be able to provide you with a precise estimate of when you can expect your shipment to arrive. Your patience is greatly appreciated as we work diligently to ensure a seamless delivery experience for you.",DELIVERY,delivery_period
